{
  "summary": "Identified reentrancy vulnerability in withdraw function with CEI pattern violation and missing guard.",
  "risk_level": "HIGH",
  "mode": "creative",
  "evidence": [
    {
      "type": "semantic_operation",
      "description": "Function transfers value before updating state",
      "code_location": "Vault.sol:L42",
      "confidence": 0.95,
      "property": "TRANSFERS_VALUE_OUT",
      "value": true
    },
    {
      "type": "behavioral_signature",
      "description": "Vulnerable CEI pattern: R:bal→X:out→W:bal detected",
      "graph_node_id": "Vault.withdraw",
      "confidence": 0.90,
      "property": "operation_sequence",
      "value": "READ_BALANCE,EXTERNAL_CALL,WRITE_BALANCE"
    },
    {
      "type": "missing_guard",
      "description": "No reentrancy guard detected on payable function",
      "graph_node_id": "Vault.withdraw",
      "confidence": 0.85,
      "property": "has_reentrancy_guard",
      "value": false
    }
  ],
  "graph_queries": [
    {
      "query": "FIND functions WHERE visibility IN [public, external] AND has_operation TRANSFERS_VALUE_OUT",
      "rationale": "Identify all value transfer functions as reentrancy candidates",
      "results_count": 3
    },
    {
      "query": "FIND functions WHERE operation_sequence CONTAINS [TRANSFERS_VALUE_OUT, WRITES_USER_BALANCE] AND has_reentrancy_guard = false",
      "rationale": "Find CEI violations without guards",
      "results_count": 1
    }
  ],
  "gaps": [
    {
      "gap_type": "missing_guard",
      "description": "Unable to determine if external contract has callback mechanism",
      "impact": "reduces_confidence"
    }
  ],
  "recommendations": [
    {
      "priority": "CRITICAL",
      "action": "Add OpenZeppelin ReentrancyGuard to withdraw function",
      "rationale": "Prevents reentrant calls during state-changing operations",
      "code_location": "Vault.sol:L38"
    },
    {
      "priority": "HIGH",
      "action": "Move balance update before external call (CEI pattern)",
      "rationale": "Ensures state consistency even if reentrancy occurs",
      "code_location": "Vault.sol:L42-L43"
    }
  ],
  "known_unknowns": {
    "has_uncertainty": true,
    "uncertainties": [
      {
        "area": "External contract behavior",
        "reason": "Cannot analyze receiver contract without full context",
        "needs_human_review": false
      }
    ]
  },
  "creative_hypotheses": [
    {
      "hypothesis": "Attacker can drain contract by recursively calling withdraw before balance update",
      "attack_path": [
        "Attacker deploys malicious contract with fallback function",
        "Attacker calls withdraw with malicious contract as receiver",
        "Fallback function calls withdraw again before balance update",
        "Process repeats until contract balance depleted"
      ],
      "feasibility": "HIGH",
      "supporting_evidence": [0, 1, 2]
    }
  ],
  "reviewer_metadata": {
    "review_duration_seconds": 45,
    "graph_queries_executed": 2,
    "code_locations_examined": 3,
    "model_used": "sonnet-4.5"
  }
}
